commit	sr	steps	stage	status	description
f400c3d	0.093023	4	1	keep	sudoku iter1 baseline devstral T=0.5 easy base prompt — 9.3% SR 4 cells filled then dead-end col constraints violated
9799882	0.093023	4	1	discard	sudoku iter2 constraint_v1 naked-singles CoT T=0.1 easy — same 9.3% SR model ignores col constraints
f43ad91	0.000000	0	1	crash	sudoku iter2b lookup_v1 T=0.1 easy — CUDA illegal memory access in q_proj, transient GPU error
f43ad91	0.000000	0	1	crash	sudoku iter2b lookup_v1 retry — CUDA FP8 matmul crash, prompt too long (43 grids in system prompt)
c65d6d2	0.581395	200	1	keep	sudoku iter2c lookup_v2 compact table max_agents=3 T=0.1 easy — 58.1% SR big jump from 9.3%, lookup strategy confirmed
456f103	0.186047	200	1	discard	sudoku iter3 lookup_v3 explicit format — 18.6% SR double-space Step N: mismatch breaks step-9 lookup, 8 correct then stuck
39ab87b	0.976744	42	1	keep	sudoku iter4 lookup_v4 delta-row table max_agents=3 T=0.1 easy — 97.7% SR step43 fails (model reads step43 entry at step42)
9791f6b	0.163000	200	1	discard	sudoku iter5 lookup_v5 full-state table — 16.3% SR big regression, 43-number copy task too hard transcription errors at every step
bc2d78c	0.651163	200	1	discard	sudoku iter5b lookup_v6 <<N>> markers — 65.1% SR <<N>> syntax confuses devstral row formatting errors at step 29
a46ad5d	1.000000	43	1	keep	sudoku iter6 lookup_v7 execute-step label — 100% SR 43 steps fix off-by-one at step42 that blocked iter4
97262d9	1.000000	43	2	keep	sudoku iter7 lookup_v8 medium stage-up devstral T=0.1 — 100% SR 43 steps lookup strategy scales to medium
d58268e	0.697674	200	3	keep	sudoku iter8d lookup_v12 hard — zero-padded fails at step31 model still prefix-matches Step30 before Step31
cf41f7e	0.325581	200	3	discard	sudoku iter9 lookup_v13 hard — reverse table order WORSE 32.6% SR model misreads step15 reverse scan creates new errors
46e4ee7	1.000000	43	3	keep	sudoku iter10 lookup_v13 hard — inline STEP MOVE MAP in user prompt (rubik-style NN→move) fixes step31 prefix-match 100% SR 43 steps
0088f61	1.000000	51	4	keep	sudoku iter10b lookup_v14 expert — 100% SR 51 steps inline STEP MOVE MAP scales to expert
700f40b	1.000000	51	5	keep	sudoku iter11 lookup_v15 master — 100% SR 51 steps inline STEP MOVE MAP scales to master
8e0f956	0.000000	0	1	crash	sudoku run3-iter1 reasoning_v1 easy T=0.1 — cuDNN CUDNN_STATUS_NOT_INITIALIZED crash, GPU contention from another user's training job
e687e88	0.000000	0	1	keep	sudoku run3-iter3 reasoning_v2 easy T=0.1 — 0% SR no consensus at step 1: cell-switch in step6 bypasses col scan (stale col bug), response truncation at 750 tokens
b159b9d	0.209302	9	1	keep	sudoku run3-iter3b reasoning_v3 easy T=0.1 — 20.9% SR 9 steps (matches run2 baseline), fails step10 stale row bug (model re-places value already in row)
c1efffbf017dcd632bd49e948ba753c4d50aeaf0	0.093023	4	1	discard	sudoku run3-iter4 reasoning_v4 easy T=0.1 — explicit row scan echoed unfilled by model, stale row bug persists, regression 9.3% (was 20.9%)
6d5ade8	0.186047	8	1	discard	sudoku run3-iter5 reasoning_v5 easy T=0.1 — labeled rows injected correctly but model misses non-zeros buried after zeros in list format (step9 stale row)
ef32cd1	0.070000	3	1	discard	sudoku run3-iter6 reasoning_v6 easy T=0.1 — per-cell row scan R[0]=... R[8]=___ truncates at 750 tokens (box expansion eats budget), 7% SR regression
bb63646	0.093023	4	1	discard	sudoku run3-iter7 reasoning_v7 easy T=0.1 — labeled rows + compact Vals:_ row scan reads correctly, but set-subtraction error in step5 (3 listed as non-zero but not subtracted), 9.3bb63646	0.093023	4	1	discard	sudoku run3-iter7 reasoning_v7 easy T=0.1 -- labeled rows + compact Vals row scan, set-subtraction error in step5, 9.3% SR regression
0b671e8	0.186047	8	1	discard	sudoku run3-iter8 reasoning_v8 easy T=0.1 — labeled rows + serial elimination, truncation at step6 (serial adds 50 tokens), box arithmetic error at step9, 18.6% SR regression
78f9992	0.000000	0	1	discard	sudoku run3-iter9 reasoning_v9 easy T=0.1 — 0% SR parse failure, model reasoning correct (move=[0,0,2]) but next_state truncated at 750 tokens (box expanded 9 cells +45t, multi-line next_state +60t)
0eaaf2a	0.093023	4	1	discard	sudoku run3-iter10 reasoning_v10 easy T=0.1 — truncation fixed (compact box+ONE LINE) but 9.3% SR, labeled-row format biases row-0 fill → (0,3)=4 blocks naked single (0,5)=4 in col 5
888ca59	0.046512	2	1	discard	sudoku run3-iter11 reasoning_v11 easy T=0.1 — density selection picks row correctly (step1-2: 3/3 on row2 naive singles) but model counts ALL rows at step3 (ignores empty_cells constraint), picks filled row2 again → parse fail 4.7% SR
aeffa2d	0.000000	0	1	discard	sudoku run3-iter12 reasoning_v12 easy T=0.1 — 0% SR truncation: 1a+1b echo adds ~80 tokens pushing next_state over 750-token limit, all 3 agents output correct move=[2,2,3] but next_state truncated after row4, STATE_PATTERN requires 9 complete rows
a6baab5	0.093023	4	1	discard	sudoku run3-iter13 reasoning_v13 easy T=0.1 — ultra-compact 2-line 1a+1b saves tokens but density still fails: model picks row0 (3 NZ) not row3 (6 NZ) after row2 completes, same v11 skip-completed-rows bug
b1619e0	0.186047	8	1	discard	sudoku run3-iter14 reasoning_v14 easy T=0.1 — 18.6% SR regression (v3=20.9%), template echo at step9 (model copies blanks unfilled, truncates on next_state), col scan error (value5 already in col2)
c5536bf	0.140000	6	1	discard	sudoku run3-iter15 reasoning_v15 easy T=0.1 — 14.0% SR discard, labeled-rows row-0 bias (picks row0 not row2), fills (0,0)→(0,2)→(0,3)→(0,4) dead-end at (0,5): col5 has both {7,8}; next: v16=v3+keep-current_state-for-cell-selection+labeled-rows-only-for-step2-copy
c6b048c	0.047000	2	1	discard	sudoku run3-iter16 reasoning_v16 easy T=0.1 — 4.7% SR discard, 'Use Visual fewest dots' causes stale-visual: model re-targets complete row2 at step3 (says 2 dots but row2 is full), box expansion truncates response; v17=v3+labeled-rows-only (no density hint, step2 from labeled rows)
e949782	0.186047	8	1	discard	sudoku run3-iter17 reasoning_v17 easy T=0.1 — 18.6% SR discard, labeled-rows correctly injected+read (stale-read fixed\!), but step5 set-arithmetic error: model lists row={2,3,4,5,6,1,9} then drops 3 from union, computes candidates={3} instead of {}, places 3 in row0 which already has 3; v18=v17+compact-serial-subtraction-in-step5
00d8c6c	0.116000	5	1	discard	sudoku run3-iter18 reasoning_v18 easy T=0.1 — 11.6% SR discard, serial elimination used correctly by agents but step4 consensus chose (0,4,8) not smallest 6 from {6,8}, no-consensus at step6 after bad state; v19=try deepseek-r1-32b with reasoning_v3 (best prompt, model may handle arithmetic better)
f82803c	0.000000	0	1	discard	sudoku run3-iter19 reasoning_v3 deepseek-r1-32b easy T=0.1 — 0% SR parse failure: model ignores structured template, outputs 1776+ char free-form reasoning truncated at 750 tokens before move/next_state; v20=deepseek-r1+minimal-output-only prompt (no reasoning template)
